{
 "kind": "quality.plan/1",
 "name": "fasteners-single",
 "description": "A classical single sampling plan for comparison: 132 items, accept with at most 3 defective.",
 "characteristic": {
  "type": "attributes"
 },
 "aql": 0.01,
 "lq": 0.05,
 "method": {
  "type": "single",
  "sample": 132,
  "acceptance": 3,
  "curtailed": true
 },
 "design": {
  "continuation": [
   [
    null,
    4.0
   ],
   [
    null,
    4.0
   ],
   [
    null,
    4.0
   ],
   [
    null,
    4.0
   ],
   [
    null,
    4.0
   ],
   [
    null,
    4.0
   ],
   [
    null,
    4.0
   ],
   [
    null,
    4.0
   ],
   [
    null,
    4.0
   ],
   [
    null,
    4.0
   ],
   [
    null,
    4.0
   ],
   [
    null,
    4.0
   ],
   [
    null,
    4.0
   ],
   [
    null,
    4.0
   ],
   [
    null,
    4.0
   ],
   [
    null,
    4.0
   ],
   [
    null,
    4.0
   ],
   [
    null,
    4.0
   ],
   [
    null,
    4.0
   ],
   [
    null,
    4.0
   ],
   [
    null,
    4.0
   ],
   [
    null,
    4.0
   ],
   [
    null,
    4.0
   ],
   [
    null,
    4.0
   ],
   [
    null,
    4.0
   ],
   [
    null,
    4.0
   ],
   [
    null,
    4.0
   ],
   [
    null,
    4.0
   ],
   [
    null,
    4.0
   ],
   [
    null,
    4.0
   ],
   [
    null,
    4.0
   ],
   [
    null,
    4.0
   ],
   [
    null,
    4.0
   ],
   [
    null,
    4.0
   ],
   [
    null,
    4.0
   ],
   [
    null,
    4.0
   ],
   [
    null,
    4.0
   ],
   [
    null,
    4.0
   ],
   [
    null,
    4.0
   ],
   [
    null,
    4.0
   ],
   [
    null,
    4.0
   ],
   [
    null,
    4.0
   ],
   [
    null,
    4.0
   ],
   [
    null,
    4.0
   ],
   [
    null,
    4.0
   ],
   [
    null,
    4.0
   ],
   [
    null,
    4.0
   ],
   [
    null,
    4.0
   ],
   [
    null,
    4.0
   ],
   [
    null,
    4.0
   ],
   [
    null,
    4.0
   ],
   [
    null,
    4.0
   ],
   [
    null,
    4.0
   ],
   [
    null,
    4.0
   ],
   [
    null,
    4.0
   ],
   [
    null,
    4.0
   ],
   [
    null,
    4.0
   ],
   [
    null,
    4.0
   ],
   [
    null,
    4.0
   ],
   [
    null,
    4.0
   ],
   [
    null,
    4.0
   ],
   [
    null,
    4.0
   ],
   [
    null,
    4.0
   ],
   [
    null,
    4.0
   ],
   [
    null,
    4.0
   ],
   [
    null,
    4.0
   ],
   [
    null,
    4.0
   ],
   [
    null,
    4.0
   ],
   [
    null,
    4.0
   ],
   [
    null,
    4.0
   ],
   [
    null,
    4.0
   ],
   [
    null,
    4.0
   ],
   [
    null,
    4.0
   ],
   [
    null,
    4.0
   ],
   [
    null,
    4.0
   ],
   [
    null,
    4.0
   ],
   [
    null,
    4.0
   ],
   [
    null,
    4.0
   ],
   [
    null,
    4.0
   ],
   [
    null,
    4.0
   ],
   [
    null,
    4.0
   ],
   [
    null,
    4.0
   ],
   [
    null,
    4.0
   ],
   [
    null,
    4.0
   ],
   [
    null,
    4.0
   ],
   [
    null,
    4.0
   ],
   [
    null,
    4.0
   ],
   [
    null,
    4.0
   ],
   [
    null,
    4.0
   ],
   [
    null,
    4.0
   ],
   [
    null,
    4.0
   ],
   [
    null,
    4.0
   ],
   [
    null,
    4.0
   ],
   [
    null,
    4.0
   ],
   [
    null,
    4.0
   ],
   [
    null,
    4.0
   ],
   [
    null,
    4.0
   ],
   [
    null,
    4.0
   ],
   [
    null,
    4.0
   ],
   [
    null,
    4.0
   ],
   [
    null,
    4.0
   ],
   [
    null,
    4.0
   ],
   [
    null,
    4.0
   ],
   [
    null,
    4.0
   ],
   [
    null,
    4.0
   ],
   [
    null,
    4.0
   ],
   [
    null,
    4.0
   ],
   [
    null,
    4.0
   ],
   [
    null,
    4.0
   ],
   [
    null,
    4.0
   ],
   [
    null,
    4.0
   ],
   [
    null,
    4.0
   ],
   [
    null,
    4.0
   ],
   [
    null,
    4.0
   ],
   [
    null,
    4.0
   ],
   [
    null,
    4.0
   ],
   [
    null,
    4.0
   ],
   [
    null,
    4.0
   ],
   [
    null,
    4.0
   ],
   [
    null,
    4.0
   ],
   [
    null,
    4.0
   ],
   [
    null,
    4.0
   ],
   [
    null,
    4.0
   ],
   [
    null,
    4.0
   ],
   [
    null,
    4.0
   ],
   [
    null,
    4.0
   ],
   [
    null,
    4.0
   ],
   [
    null,
    4.0
   ],
   [
    null,
    4.0
   ],
   [
    null,
    4.0
   ],
   [
    null,
    4.0
   ],
   [
    3.5,
    3.5
   ]
  ],
  "reject_high": true,
  "exact": true,
  "procedure": "single sampling, curtailed",
  "sequential_analysis": "0.4.0",
  "oc": {
   "aql": {
    "accept": 0.9557474941740328,
    "asn": 130.6416291148229
   },
   "lq": {
    "accept": 0.09922830442578283,
    "asn": 77.07855498836878
   }
  }
 }
}
