{
 "kind": "quality.plan/1",
 "name": "fasteners-normal",
 "description": "Incoming inspection of fasteners by attributes, normal inspection: lots of 1 % defective accepted with probability at least 0.95, lots of 5 % defective rejected with probability at least 0.90.",
 "characteristic": {
  "type": "attributes"
 },
 "aql": 0.01,
 "lq": 0.05,
 "method": {
  "type": "sequential",
  "producer_risk": 0.05,
  "consumer_risk": 0.1,
  "max_sample": 300,
  "optimal_at": "first-order"
 },
 "design": {
  "continuation": [
   [
    null,
    null
   ],
   [
    null,
    1.5
   ],
   [
    null,
    1.5
   ],
   [
    null,
    1.5
   ],
   [
    null,
    1.5
   ],
   [
    null,
    1.5
   ],
   [
    null,
    1.5
   ],
   [
    null,
    1.5
   ],
   [
    null,
    1.5
   ],
   [
    null,
    1.5
   ],
   [
    null,
    2.5
   ],
   [
    null,
    2.5
   ],
   [
    null,
    2.5
   ],
   [
    null,
    2.5
   ],
   [
    null,
    2.5
   ],
   [
    null,
    2.5
   ],
   [
    null,
    2.5
   ],
   [
    null,
    2.5
   ],
   [
    null,
    2.5
   ],
   [
    null,
    2.5
   ],
   [
    null,
    2.5
   ],
   [
    null,
    2.5
   ],
   [
    null,
    2.5
   ],
   [
    null,
    2.5
   ],
   [
    null,
    2.5
   ],
   [
    null,
    2.5
   ],
   [
    null,
    2.5
   ],
   [
    null,
    2.5
   ],
   [
    null,
    2.5
   ],
   [
    null,
    2.5
   ],
   [
    null,
    2.5
   ],
   [
    null,
    2.5
   ],
   [
    null,
    2.5
   ],
   [
    null,
    2.5
   ],
   [
    null,
    2.5
   ],
   [
    null,
    2.5
   ],
   [
    null,
    2.5
   ],
   [
    null,
    2.5
   ],
   [
    null,
    2.5
   ],
   [
    null,
    2.5
   ],
   [
    null,
    2.5
   ],
   [
    null,
    2.5
   ],
   [
    null,
    2.5
   ],
   [
    null,
    2.5
   ],
   [
    null,
    2.5
   ],
   [
    null,
    2.5
   ],
   [
    null,
    2.5
   ],
   [
    null,
    2.5
   ],
   [
    null,
    2.5
   ],
   [
    null,
    2.5
   ],
   [
    null,
    2.5
   ],
   [
    null,
    2.5
   ],
   [
    null,
    2.5
   ],
   [
    null,
    2.5
   ],
   [
    null,
    2.5
   ],
   [
    null,
    2.5
   ],
   [
    null,
    2.5
   ],
   [
    null,
    2.5
   ],
   [
    null,
    2.5
   ],
   [
    null,
    2.5
   ],
   [
    null,
    2.5
   ],
   [
    null,
    2.5
   ],
   [
    null,
    2.5
   ],
   [
    0.5,
    2.5
   ],
   [
    0.5,
    3.5
   ],
   [
    0.5,
    3.5
   ],
   [
    0.5,
    3.5
   ],
   [
    0.5,
    3.5
   ],
   [
    0.5,
    3.5
   ],
   [
    0.5,
    3.5
   ],
   [
    0.5,
    3.5
   ],
   [
    0.5,
    3.5
   ],
   [
    0.5,
    3.5
   ],
   [
    0.5,
    3.5
   ],
   [
    0.5,
    3.5
   ],
   [
    0.5,
    3.5
   ],
   [
    0.5,
    3.5
   ],
   [
    0.5,
    3.5
   ],
   [
    0.5,
    3.5
   ],
   [
    0.5,
    3.5
   ],
   [
    0.5,
    3.5
   ],
   [
    0.5,
    3.5
   ],
   [
    0.5,
    3.5
   ],
   [
    0.5,
    3.5
   ],
   [
    0.5,
    3.5
   ],
   [
    0.5,
    3.5
   ],
   [
    0.5,
    3.5
   ],
   [
    0.5,
    3.5
   ],
   [
    0.5,
    3.5
   ],
   [
    0.5,
    3.5
   ],
   [
    0.5,
    3.5
   ],
   [
    0.5,
    3.5
   ],
   [
    0.5,
    3.5
   ],
   [
    1.5,
    3.5
   ],
   [
    1.5,
    3.5
   ],
   [
    1.5,
    3.5
   ],
   [
    1.5,
    3.5
   ],
   [
    1.5,
    3.5
   ],
   [
    1.5,
    3.5
   ],
   [
    1.5,
    3.5
   ],
   [
    1.5,
    3.5
   ],
   [
    1.5,
    3.5
   ],
   [
    1.5,
    3.5
   ],
   [
    1.5,
    3.5
   ],
   [
    1.5,
    3.5
   ],
   [
    1.5,
    3.5
   ],
   [
    1.5,
    3.5
   ],
   [
    1.5,
    3.5
   ],
   [
    1.5,
    3.5
   ],
   [
    1.5,
    3.5
   ],
   [
    1.5,
    3.5
   ],
   [
    1.5,
    3.5
   ],
   [
    1.5,
    3.5
   ],
   [
    1.5,
    3.5
   ],
   [
    1.5,
    3.5
   ],
   [
    1.5,
    4.5
   ],
   [
    1.5,
    4.5
   ],
   [
    1.5,
    4.5
   ],
   [
    1.5,
    4.5
   ],
   [
    1.5,
    4.5
   ],
   [
    1.5,
    4.5
   ],
   [
    1.5,
    4.5
   ],
   [
    1.5,
    4.5
   ],
   [
    2.5,
    4.5
   ],
   [
    2.5,
    4.5
   ],
   [
    2.5,
    4.5
   ],
   [
    2.5,
    4.5
   ],
   [
    2.5,
    4.5
   ],
   [
    2.5,
    4.5
   ],
   [
    2.5,
    4.5
   ],
   [
    2.5,
    4.5
   ],
   [
    2.5,
    4.5
   ],
   [
    2.5,
    4.5
   ],
   [
    2.5,
    4.5
   ],
   [
    2.5,
    4.5
   ],
   [
    2.5,
    4.5
   ],
   [
    2.5,
    4.5
   ],
   [
    2.5,
    4.5
   ],
   [
    2.5,
    4.5
   ],
   [
    2.5,
    4.5
   ],
   [
    2.5,
    4.5
   ],
   [
    2.5,
    4.5
   ],
   [
    2.5,
    4.5
   ],
   [
    2.5,
    4.5
   ],
   [
    2.5,
    4.5
   ],
   [
    2.5,
    4.5
   ],
   [
    2.5,
    4.5
   ],
   [
    2.5,
    4.5
   ],
   [
    2.5,
    4.5
   ],
   [
    2.5,
    4.5
   ],
   [
    2.5,
    4.5
   ],
   [
    2.5,
    4.5
   ],
   [
    2.5,
    4.5
   ],
   [
    2.5,
    4.5
   ],
   [
    3.5,
    4.5
   ],
   [
    3.5,
    4.5
   ],
   [
    3.5,
    4.5
   ],
   [
    3.5,
    4.5
   ],
   [
    3.5,
    4.5
   ],
   [
    3.5,
    4.5
   ],
   [
    3.5,
    4.5
   ],
   [
    3.5,
    4.5
   ],
   [
    3.5,
    4.5
   ],
   [
    3.5,
    4.5
   ],
   [
    3.5,
    4.5
   ],
   [
    3.5,
    4.5
   ],
   [
    3.5,
    5.5
   ],
   [
    3.5,
    5.5
   ],
   [
    3.5,
    5.5
   ],
   [
    3.5,
    5.5
   ],
   [
    3.5,
    5.5
   ],
   [
    3.5,
    5.5
   ],
   [
    3.5,
    5.5
   ],
   [
    3.5,
    5.5
   ],
   [
    3.5,
    5.5
   ],
   [
    3.5,
    5.5
   ],
   [
    3.5,
    5.5
   ],
   [
    3.5,
    5.5
   ],
   [
    3.5,
    5.5
   ],
   [
    3.5,
    5.5
   ],
   [
    3.5,
    5.5
   ],
   [
    3.5,
    5.5
   ],
   [
    3.5,
    5.5
   ],
   [
    3.5,
    5.5
   ],
   [
    3.5,
    5.5
   ],
   [
    3.5,
    5.5
   ],
   [
    4.5,
    5.5
   ],
   [
    4.5,
    5.5
   ],
   [
    4.5,
    5.5
   ],
   [
    4.5,
    5.5
   ],
   [
    4.5,
    5.5
   ],
   [
    4.5,
    5.5
   ],
   [
    4.5,
    5.5
   ],
   [
    4.5,
    5.5
   ],
   [
    4.5,
    5.5
   ],
   [
    4.5,
    5.5
   ],
   [
    4.5,
    5.5
   ],
   [
    4.5,
    5.5
   ],
   [
    4.5,
    5.5
   ],
   [
    4.5,
    5.5
   ],
   [
    4.5,
    5.5
   ],
   [
    4.5,
    5.5
   ],
   [
    4.5,
    5.5
   ],
   [
    4.5,
    5.5
   ],
   [
    4.5,
    5.5
   ],
   [
    4.5,
    5.5
   ],
   [
    4.5,
    5.5
   ],
   [
    4.5,
    5.5
   ],
   [
    4.5,
    5.5
   ],
   [
    4.5,
    5.5
   ],
   [
    4.5,
    5.5
   ],
   [
    4.5,
    5.5
   ],
   [
    4.5,
    5.5
   ],
   [
    4.5,
    5.5
   ],
   [
    4.5,
    6.5
   ],
   [
    4.5,
    6.5
   ],
   [
    4.5,
    6.5
   ],
   [
    4.5,
    6.5
   ],
   [
    5.5,
    6.5
   ],
   [
    5.5,
    6.5
   ],
   [
    5.5,
    6.5
   ],
   [
    5.5,
    6.5
   ],
   [
    5.5,
    6.5
   ],
   [
    5.5,
    6.5
   ],
   [
    5.5,
    6.5
   ],
   [
    5.5,
    6.5
   ],
   [
    5.5,
    6.5
   ],
   [
    5.5,
    6.5
   ],
   [
    5.5,
    6.5
   ],
   [
    5.5,
    6.5
   ],
   [
    5.5,
    6.5
   ],
   [
    5.5,
    6.5
   ],
   [
    5.5,
    6.5
   ],
   [
    5.5,
    6.5
   ],
   [
    5.5,
    6.5
   ],
   [
    5.5,
    6.5
   ],
   [
    5.5,
    6.5
   ],
   [
    5.5,
    6.5
   ],
   [
    5.5,
    6.5
   ],
   [
    5.5,
    6.5
   ],
   [
    5.5,
    6.5
   ],
   [
    5.5,
    6.5
   ],
   [
    5.5,
    6.5
   ],
   [
    5.5,
    6.5
   ],
   [
    5.5,
    6.5
   ],
   [
    5.5,
    6.5
   ],
   [
    5.5,
    6.5
   ],
   [
    5.5,
    6.5
   ],
   [
    5.5,
    6.5
   ],
   [
    5.5,
    6.5
   ],
   [
    5.5,
    6.5
   ],
   [
    5.5,
    6.5
   ],
   [
    5.5,
    6.5
   ],
   [
    6.5,
    6.5
   ]
  ],
  "reject_high": true,
  "exact": true,
  "procedure": "kiefer_weiss_plan",
  "sequential_analysis": "0.4.0",
  "oc": {
   "aql": {
    "accept": 0.9500047607818984,
    "asn": 84.75757070823977
   },
   "lq": {
    "accept": 0.09886639644309497,
    "asn": 61.49192991685474
   }
  }
 }
}
