{
 "kind": "quality.plan/1",
 "name": "shaft-diameter",
 "description": "Inspection by variables of a shaft diameter against the upper limit 25.05 mm, measurement standard deviation 0.01 mm known from the process.",
 "characteristic": {
  "type": "variables",
  "limit": "upper",
  "value": 25.05,
  "sigma": 0.01
 },
 "aql": 0.01,
 "lq": 0.05,
 "method": {
  "type": "sequential",
  "producer_risk": 0.05,
  "consumer_risk": 0.1,
  "max_sample": 60,
  "optimal_at": "first-order"
 },
 "design": {
  "continuation": [
   [
    24.9909375,
    25.079687500000002
   ],
   [
    50.0228125,
    50.1084375
   ],
   [
    75.0540625,
    75.1371875
   ],
   [
    100.0853125,
    100.1665625
   ],
   [
    125.1171875,
    125.1953125
   ],
   [
    150.1484375,
    150.2240625
   ],
   [
    175.1803125,
    175.2528125
   ],
   [
    200.2115625,
    200.2815625
   ],
   [
    225.2428125,
    225.3109375
   ],
   [
    250.2746875,
    250.3396875
   ],
   [
    275.3059375,
    275.3684375
   ],
   [
    300.3371875,
    300.3978125
   ],
   [
    325.3684375,
    325.4265625
   ],
   [
    350.3996875,
    350.4559375
   ],
   [
    375.4315625,
    375.4846875
   ],
   [
    400.4628125,
    400.5140625
   ],
   [
    425.4940625,
    425.5428125
   ],
   [
    450.5253125,
    450.5721875
   ],
   [
    475.5565625,
    475.6009375
   ],
   [
    500.5878125,
    500.6303125
   ],
   [
    525.6190625,
    525.6590625
   ],
   [
    550.6503125,
    550.6884375
   ],
   [
    575.6815625,
    575.7178125
   ],
   [
    600.7121875,
    600.7465625
   ],
   [
    625.7434375,
    625.7759375
   ],
   [
    650.7746875,
    650.8053125
   ],
   [
    675.8059375,
    675.8346875
   ],
   [
    700.8365625,
    700.8640625
   ],
   [
    725.8678125,
    725.8928125
   ],
   [
    750.8990625,
    750.9221875000001
   ],
   [
    775.9296875,
    775.9515625
   ],
   [
    800.9609375,
    800.9809375
   ],
   [
    825.9915625,
    826.0103125
   ],
   [
    851.0221875,
    851.0403125
   ],
   [
    876.0534375,
    876.0696875
   ],
   [
    901.0840625000001,
    901.0990625000001
   ],
   [
    926.1146875000001,
    926.1284375
   ],
   [
    951.1459375000001,
    951.1578125
   ],
   [
    976.1765625,
    976.1878125000001
   ],
   [
    1001.2071875,
    1001.2171875
   ],
   [
    1026.2378125,
    1026.2465625
   ],
   [
    1051.2684375000001,
    1051.2765625
   ],
   [
    1076.2990625,
    1076.3059375
   ],
   [
    1101.3296875,
    1101.3359375
   ],
   [
    1126.3603125,
    1126.3653125
   ],
   [
    1151.3909375,
    1151.3946875
   ],
   [
    1176.4215625,
    1176.4246875000001
   ],
   [
    1201.4521875,
    1201.4546875
   ],
   [
    1226.4828125000001,
    1226.4840625
   ],
   [
    1251.5134375,
    1251.5140625000001
   ],
   [
    1276.5440625,
    1276.5440625
   ]
  ],
  "reject_high": true,
  "exact": false,
  "procedure": "kiefer_weiss_plan",
  "sequential_analysis": "0.4.0",
  "oc": {
   "aql": {
    "accept": 0.9500171812814904,
    "asn": 9.302554824367498
   },
   "lq": {
    "accept": 0.09989967641463743,
    "asn": 10.892237940873814
   }
  }
 }
}
